{
  "schema_version": 1,
  "example_id": "example-corrective-span",
  "document_group_id": "cover-letter-beta",
  "created_at": "2026-07-02T12:00:00.000Z",
  "writing_type": "cover-letter",
  "register": "professional",
  "prompt": "Write a cover letter paragraph.",
  "source_material": [
    "Synthetic source material."
  ],
  "factual_constraints": [],
  "lineage": {
    "source_kind": "correction_span",
    "source_polarity": "corrective"
  },
  "draft": {
    "candidate_id": "candidate-2",
    "text": "Generic rejected prose.",
    "model_id": "Qwen/Qwen3-4B-Instruct-2507@fixture",
    "generation_config": {},
    "rules_snapshot_hash": "rules-fixture-hash"
  },
  "final": {
    "text": "Generic rejected prose.",
    "author_provenance": "imported_correction_span",
    "finalized_at": "2026-07-02T12:30:00.000Z"
  },
  "training_eligible": false,
  "content_hash": "fixture-corrective-hash"
}
